sha256_hash,clam_av_scan_results,yara_malware,family_name,sample_name,md5_hash,sha1_hash,sha224_hash,sha384_hash,sha512_hash,ssdeep,file_size,binary_file_size,binary_file_size_kb,time_stamp,file_type_extension,summary_detected_languages,entropy(min=0.0; max=8.0),execution_section_name,execution_size_bytes,import_functions,standardized_import_functions,count_import_functions,peid,yara_packer,yara_rat,code_sections,code_section_sizes,entropy_per_section,number_sections,intra_family_cosine_similarity_cluster,intra_family_kmeans_cluster,malware_variant,malware_variant_centroid
ee44c0692fd2ab2f01d17ca4b58ca6c7f79388cbc681f885bb17ec946514088c,Win.Trojan.Agent-9874920-0,-,CobaltStrike,ee44c0692fd2ab2f01d17ca4b58ca6c7f79388cbc681f885bb17ec946514088c,7edf943ed251fa480c5ca5abb2446c75,1380d7c44efde64f471ae70563372efe18f43026,ba2e9ab7b283f2868d86647850ab09e8943ee3355d65d8d091d00f5a,4a851e7a40906e1227760b9d049f0641017bfc227e9ec9bdde40be857211b2ce634f2dcfbe8848a9bc9dbae7d4293596,9c84e4184798bdd06a4f6128242f2e7d2b8840cbf0639cd917c023bd22de3b7c2d98d072608106a94875a9655bcf1117fb3f1d0a2557cfda9b1b911f092c990c,6144:T22r1g93MFP1WWgs+oht05tnCCRem/V9FkkKdKb+/++9GIyRv9QTaq+D/aYndvK:T2+g9KzkoEtVcKb+/+EzD+7aJ,1738 kB,1737728.0,1737.728,2019:04:27 18:27:02+00:00,dll,English - United States,2.144987,.text,2147543333,[KERNEL32.DLL]  CloseHandle CreateFileW DeleteCriticalSection EnterCriticalSection ExitProcess FindClose FindFirstFileExW FindNextFileW FlushFileBuffers FreeEnvironmentStringsW FreeLibrary GetACP GetCommandLineA GetCommandLineW GetConsoleCP GetConsoleMode GetCPInfo GetCurrentProcess GetCurrentProcessId GetCurrentThreadId GetEnvironmentStringsW GetFileSizeEx GetFileType GetLastError GetModuleFileNameW GetModuleHandleExW GetModuleHandleW GetOEMCP GetProcAddress GetProcessHeap GetStartupInfoW GetStdHandle GetStringTypeW GetSystemTimeAsFileTime HeapAlloc HeapFree HeapReAlloc HeapSize InitializeCriticalSectionAndSpinCount InitializeSListHead InterlockedFlushSList IsDebuggerPresent IsProcessorFeaturePresent IsValidCodePage LCMapStringW LeaveCriticalSection LoadLibraryExW MultiByteToWideChar OutputDebugStringA QueryPerformanceCounter RaiseException ReadConsoleW ReadFile RtlCaptureContext RtlLookupFunctionEntry RtlUnwind RtlUnwindEx RtlVirtualUnwind SetFilePointerEx SetLastError SetStdHandle SetUnhandledExceptionFilter TerminateProcess TlsAlloc TlsFree TlsGetValue TlsSetValue UnhandledExceptionFilter VirtualAlloc VirtualProtect WideCharToMultiByte WriteConsoleW WriteFile,closehandle createfile deletecriticalsection entercriticalsection exitprocess findclose findfirstfile findnextfile flushfilebuffers freeenvironmentstrings freelibrary getacp getcommandline getconsole getconsolemode getcpinfo getcurrentprocess getcurrentprocessid getcurrentthreadid getenvironmentstrings getfilesize getfiletype getlasterror getmodulefilename getmodulehandle getoemcp getprocaddress getprocessheap getstartupinfo getstdhandle getstringtype getsystemtimeasfiletime heapalloc heapfree heaprealloc heapsize initializecriticalsectionandspincount initializeslisthead interlockedflushslist isdebuggerpresent isprocessorfeaturepresent isvalidcodepage lcmapstring leavecriticalsection loadlibrary multibytetowidechar outputdebugstring queryperformancecounter raiseexception readconsole readfile rtlcapturecontext rtllookupfunctionentry rtlunwind rtlvirtualunwind setfilepointer setlasterror setstdhandle setunhandledexceptionfilter terminateprocess tlsalloc tlsfree tlsgetvalue tlssetvalue unhandledexceptionfilter virtualalloc virtualprotect widechartomultibyte writeconsole writefile,73,-,-,-,.data .pdata .rdata .reloc .rsrc .text,.data(184c00) .pdata(1200)  .rdata(da00)  .reloc(800)  .rsrc(200)  .text(13e00) ,PE Header (3.009: not packed); .text (6.44919: not packed); .rdata (5.04432: not packed); .data (1.64078: not packed); .pdata (5.02497: not packed); .rsrc (4.71423: not packed); .reloc (4.89495: not packed),6,0,3,CobaltStrike.0,
21633bb2e378d40e3e13b88bf3a7fd397ad1229eab9730cf93fc2cc260fbdd4f,OK,-,CobaltStrike,21633bb2e378d40e3e13b88bf3a7fd397ad1229eab9730cf93fc2cc260fbdd4f,cb6991a10c698a7e632d3397a15a1355,cdc62df36002885fd268f4ceabecb7ec007963b4,794461087acad013df2f28f07cd14c7c6a66c7fc3cda5cfb7f57f2cb,c080c3cd691bf62163ee311f4bcd95881a5a0f8f2d3a1dfe61d3a154c0f713fccc95274f34de8f280cf471df89ec2038,07eb1a7cad56c7349bd8c895ccf720db2c27a93d0303ffaaaf56b15ac73606d3335a6169a8e4ea36c4f2ff7133664bf24027bff36a919037c56c4e511811162d,12288:WA+QuYAS3W3ew5ZqFfbIKGgiNz40L3D+AjZWQcpWFYK9751tjxt888888888888:WAXuYAS31GSdozp3D+Ajsg97L,853 kB,852992.0,852.992,2021:03:15 10:47:33+00:00,exe,Czech - Czech Republic; English - United States,7.561849,.text,18446744073438546643,[ADVAPI32.DLL]  RegOpenKeyW RegQueryValueExW [GDI32.DLL]  AddFontResourceW CreateMetaFileW EndPage FlattenPath GdiFlush GetBkColor GetColorSpace GetTextAlign StrokePath UpdateColors [KERNEL32.DLL]  GetModuleHandleA GetProcAddress LoadLibraryA SetErrorMode [USER32.DLL]  CharLowerA CharNextA CloseClipboard CountClipboardFormats CreateMenu EndMenu GetAsyncKeyState GetClipboardViewer GetDoubleClickTime GetMenuItemCount GetMessagePos GetQueueStatus GetShellWindow GetWindowContextHelpId IsGUIThread IsWindowEnabled LoadIconA ReleaseCapture ShowCaret,addfontresource charlower charnext closeclipboard countclipboardformats createmenu createmetafile endmenu endpage flattenpath gdiflush getasynckeystate getbkcolor getclipboardviewer getcolorspace getdoubleclicktime getmenuitemcount getmessagepos getmodulehandle getprocaddress getqueuestatus getshellwindow gettextalign getwindowcontexthelpid isguithread iswindowenabled loadicon loadlibrary regopenkey regqueryvalue releasecapture seterrormode showcaret strokepath updatecolors,35,-,-,-,.data .data2 .pdata .rdata .rsrc .text,.data(200) .data2(2c00)  .pdata(200)  .rdata(600)  .rsrc(9600)  .text(c3400) ,PE Header (2.42361: not packed); .text (7.62836: packed); .rdata (4.17096: not packed); .data (2.08087: not packed); .pdata (1.37435: not packed); .data2 (0.00012808: not packed); .rsrc (3.70774: not packed),6,-1,1,,
7cd70b5e3a4e9faba7aee9b0a0784d61ed804096f834c773e8357efcdc8be966,Win.Malware.Bulz-9885329-0,win_epsilon_red_auto,CobaltStrike,7cd70b5e3a4e9faba7aee9b0a0784d61ed804096f834c773e8357efcdc8be966,cd9759458569109a01572d9c25626ea7,1359bed9249437c5032496f5a4559490a53fd16a,79856f9e8373fad865dcbce017c502f18723e42a01bcef245795d3d8,bd1b49959d5a736fa6390193140783df9135f482ebc700e572d7a059cb48966f7d19417119c7c6b6a06833696b0041c8,590ee14ef850450c10e424e13d32f156a74c6db6d1d0e0ea1b4956b1de63e22b511f79023f14874508fca0dc2566583321ae4438f20e1fcb0550c498ad9f6107,24576:hYlJXepOovecoTdgmyw05H1lJplibEUNxFlbE1R:WXexvec0QwEHJybE8vbE1R,1948 kB,1947824.0,1947.824,0000:00:00 00:00:00,exe,English - United States,5.912757,.text,928001,[KERNEL32.DLL]  AddVectoredExceptionHandler CloseHandle CreateEventA CreateIoCompletionPort CreateThread CreateWaitableTimerExW DuplicateHandle ExitProcess FreeEnvironmentStringsW GetConsoleMode GetEnvironmentStringsW GetProcAddress GetProcessAffinityMask GetQueuedCompletionStatusEx GetStdHandle GetSystemDirectoryA GetSystemInfo GetThreadContext LoadLibraryA LoadLibraryW PostQueuedCompletionStatus ResumeThread SetConsoleCtrlHandler SetErrorMode SetEvent SetProcessPriorityBoost SetThreadContext SetUnhandledExceptionFilter SetWaitableTimer Sleep SuspendThread SwitchToThread VirtualAlloc VirtualFree VirtualQuery WaitForMultipleObjects WaitForSingleObject WriteConsoleW WriteFile,addvectoredexceptionhandler closehandle createevent createiocompletionport createthread createwaitabletimer duplicatehandle exitprocess freeenvironmentstrings getconsolemode getenvironmentstrings getprocaddress getprocessaffinitymask getqueuedcompletionstatus getstdhandle getsystemdirectory getsysteminfo getthreadcontext loadlibrary postqueuedcompletionstatus resumethread setconsolectrlhandler seterrormode setevent setprocesspriorityboost setthreadcontext setunhandledexceptionfilter setwaitabletimer sleep suspendthread switchtothread virtualalloc virtualfree virtualquery waitformultipleobjects waitforsingleobject writeconsole writefile,39,HQR data file,-,-,.data .idata .rdata .reloc .rsrc .symtab .text,.data(18400) .idata(600)  .rdata(d6600)  .reloc(8800)  .rsrc(400)  .symtab(200)  .text(e2c00) ,PE Header (1.51848: not packed); .text (5.92728: not packed); .rdata (5.22798: not packed); .data (4.49199: not packed); .idata (3.56702: not packed); .reloc (5.44139: not packed); .symtab (0.0232109: not packed); .rsrc (3.18652: not packed); Overlay (7.71281: packed),7,2,7,CobaltStrike.2,
669fcafcaf217a0ae7776d1c98b6cbb4fd75fb97b12965185136a09c7bfc0ef2,Win.Trojan.CobaltStrike-7899872-1,CobaltStrike_Resources_Artifact32_v3_14_to_v4_x; HKTL_Imphashes_Aug22_1,CobaltStrike,669fcafcaf217a0ae7776d1c98b6cbb4fd75fb97b12965185136a09c7bfc0ef2,8d8d168e25d41e2d4304c08cb3105d9b,95b5faae967015333cf1a5e3849f437e4122a054,daa84700c8f18e9007f58c8db214a7cbd36413e41c6cd5686769282f,6c4e0007dbcbb7f288890b8974864db92a29795c3716ff7951abb88a8268e27b9b7a7a4287268fd9b478b78d7ef30183,ab02629b967e72ff6933cea470c84282b55fb59afc20e5a29b8a25f620477e8dee1858af30b592f421479def4ed309777d06ea9734bbaecd56eb87f95e8a213e,3072:KR15m+yOMvRli6eKU3jPmrOH4PXjel/51+YtwpxoqGZ21SQ1P9Kz:KR/z683jGoIjel/51+qmPD1SQJ9,285 kB,284672.0,284.672,2020:06:09 00:17:16+00:00,exe,-,6.488652,.text,6177,[KERNEL32.DLL]  CloseHandle ConnectNamedPipe CreateFileA CreateNamedPipeA CreateThread DeleteCriticalSection EnterCriticalSection FreeLibrary GetCurrentProcess GetCurrentProcessId GetCurrentThreadId GetLastError GetModuleHandleA GetProcAddress GetStartupInfoA GetSystemTimeAsFileTime GetTickCount InitializeCriticalSection LeaveCriticalSection LoadLibraryA LoadLibraryW QueryPerformanceCounter ReadFile SetUnhandledExceptionFilter Sleep TerminateProcess TlsGetValue UnhandledExceptionFilter VirtualAlloc VirtualProtect VirtualQuery WriteFile [MSVCRT.DLL]  Dllonexit Getmainargs Initenv LconvInit SetAppType Setusermatherr Acmdln AmsgExit Cexit Fmode Initterm Iob Lock Onexit Unlock Winmajor abort calloc exit fprintf free fwrite malloc memcpy signal sprintf strlen strncmp vfprintf,abort acmdln amsgexit calloc cexit closehandle connectnamedpipe createfile createnamedpipe createthread deletecriticalsection dllonexit entercriticalsection exit fmode fprintf free freelibrary fwrite getcurrentprocess getcurrentprocessid getcurrentthreadid getlasterror getmainargs getmodulehandle getprocaddress getstartupinfo getsystemtimeasfiletime gettickcount initenv initializecriticalsection initterm iob lconvinit leavecriticalsection loadlibrary lock malloc memcpy onexit queryperformancecounter readfile setapptype setunhandledexceptionfilter setusermatherr signal sleep sprintf strlen strncmp terminateprocess tlsgetvalue unhandledexceptionfilter unlock vfprintf virtualalloc virtualprotect virtualquery winmajor writefile,61,-,-,-,.bss .crt .data .idata .rdata .text .tls,.bss(0) .crt(200)  .data(42600)  .idata(800)  .rdata(400)  .text(1e00)  .tls(200) ,PE Header (1.96917: not packed); .text (5.85574: not packed); .data (6.48748: not packed); .rdata (4.35624: not packed); .idata (4.60754: not packed); .CRT (0.251948: not packed); .tls (0.227638: not packed),7,1,2,CobaltStrike.1,
7920fb3873012f1abef8c2abfb905e53317595874985f24b23fb318b54b1e243,OK,-,CobaltStrike,7920fb3873012f1abef8c2abfb905e53317595874985f24b23fb318b54b1e243,3f7bbc7494ea66b267b1aa428a519465,4a2d82a4c5d5929736fc6b45cf470d7fad74180e,c78d9af1bee9500702b76263929e2f3859091b8ca5e6dc1dc32e4a3e,10265dc22e61ab43287da642fd6be443640e8d444ec53f71067e27f2b6a7dbdd9810d4615f925d37cefc441bc44a5a5d,5da5c6c60bcd1bf7bce21ddd928704c718a36f7755362c4ac0b6ae5682ce2a9bb7069c292aae7e2f38e55c8058489d31df5d443e08646628561b69a4b342a559,12288:CHWfljeqszyna7vj+GHrdGZdvLVU+PlyfvxOu2KXPlrH:n0Sna7L1rd8VUMl+5flrH,549 kB,549120.0,549.12,2021:07:07 01:53:05+00:00,exe,English - United States,7.230983,.text,166561,[ADVAPI32.DLL]  RegCloseKey RegCreateKeyExW RegDeleteKeyW RegEnumKeyW RegOpenKeyExW RegOpenKeyW RegQueryValueExW RegQueryValueW RegSetValueExW [GDI32.DLL]  CreateBitmap DeleteDC DeleteObject Escape ExtTextOutW GetClipBox GetDeviceCaps GetObjectW GetStockObject OffsetViewportOrgEx PtVisible RectVisible RestoreDC SaveDC ScaleViewportExtEx ScaleWindowExtEx SelectObject SetBkColor SetMapMode SetTextColor SetViewportExtEx SetViewportOrgEx SetWindowExtEx TextOutW [KERNEL32.DLL]  CloseHandle CompareStringW ConvertDefaultLocale CreateFileA DecodePointer DeleteCriticalSection EncodePointer EnterCriticalSection EnumResourceLanguagesW ExitProcess FindResourceW FlsAlloc FlsFree FlsGetValue FlsSetValue FlushFileBuffers FormatMessageW FreeEnvironmentStringsW FreeLibrary FreeResource GetACP GetCommandLineW GetConsoleCP GetConsoleMode GetConsoleOutputCP GetCPInfo GetCurrentProcess GetCurrentProcessId GetCurrentThread GetCurrentThreadId GetEnvironmentStringsW GetFileType GetLastError GetLocaleInfoA GetLocaleInfoW GetModuleFileNameA GetModuleFileNameW GetModuleHandleW GetOEMCP GetProcAddress GetStartupInfoA GetStartupInfoW GetStdHandle GetStringTypeA GetStringTypeW GetSystemTimeAsFileTime GetTickCount GetVersionExA GetVersionExW GlobalAddAtomW GlobalAlloc GlobalDeleteAtom GlobalFindAtomW GlobalFlags GlobalFree GlobalHandle GlobalLock GlobalReAlloc GlobalUnlock HeapAlloc HeapCreate HeapFree HeapQueryInformation HeapReAlloc HeapSetInformation HeapSize InitializeCriticalSection InitializeCriticalSectionAndSpinCount IsDebuggerPresent IsValidCodePage LCMapStringA LCMapStringW LeaveCriticalSection LoadLibraryA LoadLibraryW LoadResource LocalAlloc LocalFree LocalReAlloc LockResource lstrcmpA lstrcmpW lstrlenA lstrlenW MulDiv MultiByteToWideChar QueryPerformanceCounter RaiseException ReadFile RtlCaptureContext RtlLookupFunctionEntry RtlPcToFileHeader RtlUnwindEx RtlVirtualUnwind SetErrorMode SetFilePointer SetHandleCount SetLastError SetStdHandle SetUnhandledExceptionFilter SizeofResource Sleep TerminateProcess TlsAlloc TlsFree TlsGetValue TlsSetValue UnhandledExceptionFilter WideCharToMultiByte WriteConsoleA WriteConsoleW WriteFile WritePrivateProfileStringW [OLEACC.DLL]  CreateStdAccessibleObject LresultFromObject [OLEAUT32.DLL]  VariantClear VariantCopy VariantTimeToDosDateTime [SHLWAPI.DLL]  PathFindExtensionW PathFindFileNameW [USER32.DLL]  AdjustWindowRectEx AppendMenuW BeginPaint CallNextHookEx CallWindowProcW CheckMenuItem ClientToScreen CopyRect CreateDialogIndirectParamW CreateWindowExW DefWindowProcW DestroyMenu DestroyWindow DispatchMessageW DrawIcon DrawTextExW DrawTextW EnableMenuItem EnableWindow EndDialog EndPaint GetActiveWindow GetCapture GetClassInfoExW GetClassInfoW GetClassLongPtrW GetClassNameW GetClientRect GetCursorPos GetDC GetDesktopWindow GetDlgCtrlID GetDlgItem GetFocus GetForegroundWindow GetKeyState GetLastActivePopup GetMenu GetMenuCheckMarkDimensions GetMenuItemCount GetMenuItemID GetMenuState GetMessagePos GetMessageTime GetMessageW GetNextDlgTabItem GetParent GetPropW GetSubMenu GetSysColor GetSysColorBrush GetSystemMenu GetSystemMetrics GetTopWindow GetWindow GetWindowLongPtrW GetWindowLongW GetWindowPlacement GetWindowRect GetWindowTextW GetWindowThreadProcessId GrayStringW IsDialogMessageW IsIconic IsWindow IsWindowEnabled IsWindowVisible LoadBitmapW LoadCursorW LoadIconW MapWindowPoints MessageBoxW ModifyMenuW PeekMessageW PostMessageW PostQuitMessage PtInRect RegisterClassW RegisterWindowMessageW ReleaseDC RemovePropW SendDlgItemMessageA SendDlgItemMessageW SendMessageW SetActiveWindow SetCursor SetFocus SetForegroundWindow SetMenu SetMenuItemBitmaps SetPropW SetWindowLongPtrW SetWindowPos SetWindowsHookExW SetWindowTextW ShowWindow SystemParametersInfoA TabbedTextOutW TranslateMessage UnhookWindowsHookEx UnregisterClassW UpdateWindow ValidateRect WinHelpW [WINSPOOL.DRV] ClosePrinter DocumentPropertiesW OpenPrinterW,adjustwindowrect appendmenu beginpaint callnexthook callwindowproc checkmenuitem clienttoscreen closehandle closeprinter comparestring convertdefaultlocale copyrect createbitmap createdialogindirectparam createfile createstdaccessibleobject createwindow decodepointer defwindowproc deletecriticalsection deletedc deleteobject destroymenu destroywindow dispatchmessage documentproperties drawicon drawtext enablemenuitem enablewindo encodepointer enddialog endpaint entercriticalsection enumresourcelanguages escape exitprocess exttextout findresource flsalloc flsfree flsgetvalue flssetvalue flushfilebuffers formatmessage freeenvironmentstrings freelibrary freeresource getacp getactivewindow getcapture getclassinfo getclasslongptr getclassname getclientrect getclipbox getcommandline getconsole getconsolemode getconsoleoutput getcpinfo getcurrentprocess getcurrentprocessid getcurrentthread getcurrentthreadid getcursorpos getdc getdesktopwindow getdevicecaps getdlgctrlid getdlgitem getenvironmentstrings getfiletype getfocus getforegroundwindow getkeystate getlastactivepopup getlasterror getlocaleinfo getmenu getmenucheckmarkdimensions getmenuitemcount getmenuitemid getmenustate getmessage getmessagepos getmessagetime getmodulefilename getmodulehandle getnextdlgtabitem getobject getoemcp getparent getprocaddress getprop getstartupinfo getstdhandle getstockobject getstringtype getsubmenu getsyscolor getsyscolorbrush getsystemmenu getsystemmetrics getsystemtimeasfiletime gettickcount gettopwindow getversion getwindow getwindowlong getwindowlongptr getwindowplacement getwindowrect getwindowtext getwindowthreadprocessid globaladdatom globalalloc globaldeleteatom globalfindatom globalflags globalfree globalhandle globallock globalrealloc globalunlock graystring heapalloc heapcreate heapfree heapqueryinformation heaprealloc heapsetinformation heapsize initializecriticalsection initializecriticalsectionandspincount isdebuggerpresent isdialogmessage isiconic isvalidcodepage iswindow iswindowenabled iswindowvisible lcmapstring leavecriticalsection loadbitmap loadcursor loadicon loadlibrary loadresource localalloc localfree localrealloc lockresource lresultfromobject lstrcmp lstrlen mapwindowpoints messagebox modifymenu muldiv multibytetowidechar offsetviewportorg openprinter pathfindextension pathfindfilename peekmessage postmessage postquitmessage ptinrect ptvisible queryperformancecounter raiseexception readfile rectvisible regclosekey regcreatekey regdeletekey regenumkey registerclass registerwindowmessage regopenkey regqueryvalue regsetvalue releasedc removeprop restoredc rtlcapturecontext rtllookupfunctionentry rtlpctofileheader rtlunwind rtlvirtualunwind savedc scaleviewportext scalewindowext selectobject senddlgitemmessage sendmessage setactivewindow setbkcolor setcursor seterrormode setfilepointer setfocus setforegroundwindow sethandlecount setlasterror setmapmode setmenu setmenuitembitmaps setprop setstdhandle settextcolor setunhandledexceptionfilter setviewportextex setviewportorgex setwindowext setwindowlongptr setwindowpos setwindowshook setwindowtext showwindow sizeofresource sleep systemparametersinfo tabbedtextout terminateprocess textout tlsalloc tlsfree tlsgetvalue tlssetvalue translatemessage unhandledexceptionfilter unhookwindowshook unregisterclass updatewindow validaterect variantclear variantcopy varianttimetodosdatetime widechartomultibyte winhelp winspool.drv writeconsole writefile writeprivateprofilestring,260,-,-,-,.data .pdata .rdata .reloc .rsrc .text,.data(2c00) .pdata(3000)  .rdata(e000)  .reloc(2800)  .rsrc(44400)  .text(2a600) ,PE Header (2.77396: not packed); .text (6.34192: not packed); .rdata (4.43856: not packed); .data (3.31095: not packed); .pdata (5.26032: not packed); .rsrc (7.92589: packed); .reloc (2.19961: not packed); Overlay (7.16902: packed),6,3,6,CobaltStrike.3,CobaltStrike.3
956e66f820c127b655c4e59af455c4cc827d43b111f4cf260b6da1d30ac443b2,Win.Trojan.Generic-9879180-0,-,CobaltStrike,956e66f820c127b655c4e59af455c4cc827d43b111f4cf260b6da1d30ac443b2,7d018423023461e09eb3b64b961092dd,73173c8c64e63ad659dc174bd4c06de5ec041179,a375e932d005a0f574b23555c07d356ec0961d3c01f86e8e5e57e9b4,d81aceddc4f30d136210f8e6b9bebfc54507d8d5543ed6cbcbacd3c1aa91986589d969e8ef93d82bc641df12fc80ddfe,2bce2a16acef8f4c129f85b5506b666b0c9d30effa3b5188ef1bb503c7ebff1ee03916c5661fed4918232d2064b5ad110b3c7192a7c2037de236193eda7853bd,6144:vpWMSmgY0IyFpXjsCEqhp3xuo8Pr7Jjc7wPx5C:kHP7LFVst+0oA71+KC,348 kB,348160.0,348.16,2021:07:25 09:50:02+00:00,exe,Chinese - PRC,7.810941,.rda,4012856944,[GDI32.DLL]  GetBitmapBits GetCharWidthW GetDeviceCaps GetObjectW GetPaletteEntries [KERNEL32.DLL]  AddConsoleAliasA DeleteVolumeMountPointW EnumSystemLocalesA EraseTape FillConsoleOutputAttribute FindFirstFileA GetConsoleCursorInfo GetCurrentConsoleFont GetLocaleInfoW GetModuleHandleA GetModuleHandleW GetProcAddress GetProcessAffinityMask GlobalAddAtomW GlobalFindAtomA HeapCreate HeapWalk LoadLibraryA LoadLibraryExW LocalFree LockFile SetFileAttributesW [MSVCRT.DLL]  memset [OLE32.DLL]  CoFreeUnusedLibrariesEx [POWRPROF.DLL]  IsPwrHibernateAllowed ReadGlobalPwrPolicy [USER32.DLL]  GetClipboardFormatNameA GetWindowRect InsertMenuA IsWindow SetCursor ShowCaret [WININET.DLL]  RetrieveUrlCacheEntryStreamW [WINSPOOL.DRV] FindNextPrinterChangeNotification,addconsolealias cofreeunusedlibraries deletevolumemountpoint enumsystemlocales erasetape fillconsoleoutputattribute findfirstfile findnextprinterchangenotification getbitmapbits getcharwidth getclipboardformatname getconsolecursorinfo getcurrentconsolefont getdevicecaps getlocaleinfo getmodulehandle getobject getpaletteentries getprocaddress getprocessaffinitymask getwindowrect globaladdatom globalfindatom heapcreate heapwalk insertmenu ispwrhibernateallowed iswindow loadlibrary localfree lockfile memset readglobalpwrpolicy retrieveurlcacheentrystream setcursor setfileattributes showcaret winspool.drv,39,-,-,-,.data1 .m5fih .rda .rdata .reloc,.data1(5000) .m5fih(1000)  .rda(4c000)  .rdata(1000)  .reloc(1000) ,PE Header (0.904292: not packed); .rda (7.95355: packed); .rdata (4.24049: not packed); .data1 (7.31231: packed); .m5Fih (0.924854: not packed); .reloc (3.60979: not packed),5,4,4,CobaltStrike.4,
