sha256_hash,clam_av_scan_results,yara_malware,family_name,sample_name,md5_hash,sha1_hash,sha224_hash,sha384_hash,sha512_hash,ssdeep,file_size,binary_file_size,binary_file_size_kb,time_stamp,file_type_extension,summary_detected_languages,entropy(min=0.0; max=8.0),execution_section_name,execution_size_bytes,import_functions,standardized_import_functions,count_import_functions,peid,yara_packer,yara_rat,code_sections,code_section_sizes,entropy_per_section,number_sections,intra_family_cosine_similarity_cluster,intra_family_kmeans_cluster,malware_variant,malware_variant_centroid
24197e271f0a1ae404e7e136a4d79d4e90537c18b4c598bef0801e32ca63b8c0,OK,Cobaltbaltstrike_Payload_Encoded,CobaltStrike,24197e271f0a1ae404e7e136a4d79d4e90537c18b4c598bef0801e32ca63b8c0,761d36c460ba5f48935baab51f4f6491,4ced40256273c454f1ec5280fd9bd4ad22d90d5d,7ba636e12be286ad483696d8ae3f3ac08f4543dd419b7b93a083a424,472576dcff93d0d8f70db3a0a8fa25d4fbea3908755a7c5a926961a4c8bfb7237994f031ac36ff24ae44523bfa40523f,cc319ecacfb8f0822530b709680454d9abcf88765756d0a7f3ce21a2636bc4fdb1c617812ed05f4b50ee9abe833d4c8dfb698224efafe632b779f9e690ec233f,3072:0ZVzAbQhPbgWtWJO9Uv7dH4p7XPq/Fktx/V2iHBqNt/UnHWTCyjpn:QE0bAH4pzS6/V2gqPjpn,123 kB,122880.0,122.88,2021:06:05 05:40:04+00:00,exe,English - United States,6.485121,.text,85036,[KERNEL32.DLL]  CloseHandle CompareStringW CreateFileW DecodePointer DeleteCriticalSection EnterCriticalSection ExitProcess FindClose FindFirstFileExW FindNextFileW FlushFileBuffers FreeEnvironmentStringsW FreeLibrary GetACP GetCommandLineA GetCommandLineW GetConsoleMode GetConsoleOutputCP GetCPInfo GetCurrentProcess GetCurrentProcessId GetCurrentThreadId GetEnvironmentStringsW GetFileSizeEx GetFileType GetLastError GetModuleFileNameW GetModuleHandleExW GetModuleHandleW GetOEMCP GetProcAddress GetProcessHeap GetStartupInfoW GetStdHandle GetStringTypeW GetSystemTimeAsFileTime HeapAlloc HeapFree HeapReAlloc HeapSize InitializeCriticalSectionAndSpinCount InitializeSListHead IsDebuggerPresent IsProcessorFeaturePresent IsValidCodePage LCMapStringW LeaveCriticalSection LoadLibraryExW MultiByteToWideChar QueryPerformanceCounter RaiseException RtlUnwind SetEnvironmentVariableW SetFilePointerEx SetLastError SetStdHandle SetUnhandledExceptionFilter TerminateProcess TlsAlloc TlsFree TlsGetValue TlsSetValue UnhandledExceptionFilter VirtualAlloc VirtualProtect WideCharToMultiByte WriteConsoleW WriteFile,closehandle comparestring createfile decodepointer deletecriticalsection entercriticalsection exitprocess findclose findfirstfile findnextfile flushfilebuffers freeenvironmentstrings freelibrary getacp getcommandline getconsolemode getconsoleoutput getcpinfo getcurrentprocess getcurrentprocessid getcurrentthreadid getenvironmentstrings getfilesize getfiletype getlasterror getmodulefilename getmodulehandle getoemcp getprocaddress getprocessheap getstartupinfo getstdhandle getstringtype getsystemtimeasfiletime heapalloc heapfree heaprealloc heapsize initializecriticalsectionandspincount initializeslisthead isdebuggerpresent isprocessorfeaturepresent isvalidcodepage lcmapstring leavecriticalsection loadlibrary multibytetowidechar queryperformancecounter raiseexception rtlunwind setenvironmentvariable setfilepointer setlasterror setstdhandle setunhandledexceptionfilter terminateprocess tlsalloc tlsfree tlsgetvalue tlssetvalue unhandledexceptionfilter virtualalloc virtualprotect widechartomultibyte writeconsole writefile,68,-,-,-,.data .rdata .reloc .rsrc .text,.data(a00) .rdata(7200)  .reloc(1000)  .rsrc(200)  .text(14e00) ,PE Header (2.66768: not packed); .text (6.61258: packed); .rdata (5.23597: not packed); .data (1.86344: not packed); .rsrc (4.70432: not packed); .reloc (6.45519: not packed),5,0,3,CobaltStrike.0,
942a315f52b49601cb8a2080fa318268f7a670194f9c5be108d936db32affd52,OK,-,CobaltStrike,d120e20c7e868c1ce1b94ed63318be6d,d120e20c7e868c1ce1b94ed63318be6d,3e47e0c096a0c789aabd070c455333286fec32eb,5626f9b252a1753ac6126b6b4df857066e6511e4fe115dae57130e2d,6646356e0daab4a13b936551233cdf6a140dac5a9da56354da69fc8a3be8f7fa571483c9e9c4d4e49be6d3c6028ca97c,fd23f89972d4ca21aa977259584cf87be1229da1b82610f55b3386a9b2c433fae566ca46db96e34a30af307a5f56613a9c5011587d46a5d498d4ef70211e13be,12288:Vr92hx6QkXcrTStFkGJ9NmDqInEegbMEQHP+B9P6t7Xs013Fbu9FRvXdb:Shwjs/MnHIEvQHP+B9P+I013FbuJvtb,747 kB,746824.0,746.824,2021:05:23 03:19:28+00:00,exe,Chinese - PRC,7.190421,-,0,[KERNEL32.DLL]  DeleteCriticalSection EnterCriticalSection GetCurrentProcess GetCurrentProcessId GetCurrentThreadId GetLastError GetStartupInfoA GetSystemTimeAsFileTime GetTickCount InitializeCriticalSection LeaveCriticalSection QueryPerformanceCounter RtlAddFunctionTable RtlCaptureContext RtlLookupFunctionEntry RtlVirtualUnwind SetUnhandledExceptionFilter Sleep TerminateProcess TlsGetValue UnhandledExceptionFilter VirtualAlloc VirtualProtect VirtualQuery [MSVCRT.DLL]  CSpecificHandler Getmainargs Initenv IobFunc LconvInit SetAppType Setusermatherr Acmdln AmsgExit Cexit Fmode Initterm Onexit abort calloc clock exit fprintf free fwrite malloc memcpy signal strlen strncmp vfprintf,abort acmdln amsgexit calloc cexit clock cspecifichandler deletecriticalsection entercriticalsection exit fmode fprintf free fwrite getcurrentprocess getcurrentprocessid getcurrentthreadid getlasterror getmainargs getstartupinfo getsystemtimeasfiletime gettickcount initenv initializecriticalsection initterm iobfunc lconvinit leavecriticalsection malloc memcpy onexit queryperformancecounter rtladdfunctiontable rtlcapturecontext rtllookupfunctionentry rtlvirtualunwind setapptype setunhandledexceptionfilter setusermatherr signal sleep strlen strncmp terminateprocess tlsgetvalue unhandledexceptionfilter vfprintf virtualalloc virtualprotect virtualquery,50,-,-,-,.bss .crt .data .idata .pdata .rdata .rsrc .text .tls .xdata,.bss(0) .crt(200)  .data(55400)  .idata(800)  .pdata(400)  .rdata(a00)  .rsrc(10e00)  .text(1e00)  .tls(200)  .xdata(200) ,PE Header (2.31585: not packed); .text (6.14305: not packed); .data (7.99909: packed); .rdata (3.8676: not packed); .pdata (2.84338: not packed); .xdata (3.77076: not packed); .idata (4.15615: not packed); .CRT (0.268356: not packed); .tls (0.00281776: not packed); .rsrc (3.26223: not packed); (1.40309: not packed); (6.02749: not packed); (4.60266: not packed); (5.58281: not packed); (3.76268: not packed); (4.88936: not packed); (2.21057: not packed); (1.3375: not packed); Overlay (3.80163: not packed),10,1,2,CobaltStrike.1,
d4b64e363b4b26f82ca61f3890329c9f0978820f4107eb3d95309bc9adbfd280,OK,-,CobaltStrike,d4b64e363b4b26f82ca61f3890329c9f0978820f4107eb3d95309bc9adbfd280,62b3f2c6e198d43403ca9ef0b63565f1,fc8105698955688c59697fa2fc5ec35fefcc15e2,12f7cd02ab96b55cf88331686db638a2429cf767ba2e7065d67117cf,27b3350cb1a77c7d3bc5fa03b4c80dd8b67e189892e9f421f0a64f5524d27e76913746d204e05af7c1883f4a4291e7bf,034fc1b6a1d8c885a6ecbfbc13e5aa0e0cdd104e15d28702a264bf8a392af6660c0775cdb25865830b877a40b0d014b044db8f312954f276ee4923440d7ca92f,24576:R+HZ4FzfgUw2AflWNRpuKjJ4Td3kJnbsPhnzqgqnOwyq3W8K:R+5UvJ4Td3mbsPhneLu8K,2.6 MB,2568344.0,2568.344,2021:07:28 04:39:51+00:00,exe,English - United States,5.219846,-,0,[KERNEL32.DLL]  DeleteCriticalSection EnterCriticalSection FreeLibrary GetLastError GetModuleHandleA GetProcAddress GetStartupInfoA InitializeCriticalSection IsDBCSLeadByteEx LeaveCriticalSection LoadLibraryA MultiByteToWideChar SetUnhandledExceptionFilter Sleep TlsGetValue VirtualAlloc VirtualFree VirtualProtect VirtualQuery WideCharToMultiByte [MSVCRT.DLL]  LcCodepageFunc MbCurMaxFunc CSpecificHandler Getmainargs Initenv IobFunc LconvInit SetAppType Setusermatherr Acmdln AmsgExit Cexit Commode Errno Fileno Fmode Initterm Lock Onexit Setjmp Setmode Unlock abort calloc exit fflush fprintf fputc free fwrite localeconv longjmp malloc memcpy memset signal strerror strlen strncmp vfprintf wcslen,abort acmdln amsgexit calloc cexit commode cspecifichandler deletecriticalsection entercriticalsection errno exit fflush fileno fmode fprintf fputc free freelibrary fwrite getlasterror getmainargs getmodulehandle getprocaddress getstartupinfo initenv initializecriticalsection initterm iobfunc isdbcsleadbyte lccodepagefunc lconvinit leavecriticalsection loadlibrary localeconv lock longjmp malloc mbcurmaxfunc memcpy memset multibytetowidechar onexit setapptype setjmp setmode setunhandledexceptionfilter setusermatherr signal sleep strerror strlen strncmp tlsgetvalue unlock vfprintf virtualalloc virtualfree virtualprotect virtualquery wcslen widechartomultibyte,61,-,-,-,.bss .crt .data .idata .pdata .rdata .reloc .rsrc .text .tls .xdata,.bss(0) .crt(200)  .data(200)  .idata(a00)  .pdata(1000)  .rdata(120000)  .reloc(8400)  .rsrc(57e00)  .text(ec00)  .tls(200)  .xdata(e00) ,PE Header (2.32957: not packed); .text (6.19039: not packed); .data (1.15104: not packed); .rdata (3.85667: not packed); (0.00281776: not packed); .pdata (4.73967: not packed); .xdata (4.09388: not packed); .idata (3.76116: not packed); .CRT (0.34884: not packed); .tls (0.00281776: not packed); .rsrc (5.30586: not packed); .reloc (5.42933: not packed); (0.239357: not packed); (5.09527: not packed); (2.111: not packed); (2.38154: not packed); (1.85952: not packed); Overlay (5.12128: not packed),11,-1,0,,
cd8256d1c896a8de9ccf50e26f97106295f4e664aef6ba3ee0883420c01ac374,Win.Malware.Shelma-9871254-0,-,CobaltStrike,cd8256d1c896a8de9ccf50e26f97106295f4e664aef6ba3ee0883420c01ac374,4b4626d154babe5370a8abd40bbba3bf,bd95458097dd348e3cffaf9a4b7c06d995b9c7a7,dd67d14baff342956bce8e9b424a9121fa49fee88272d9307c807132,7f4fe1671c8331a8d18a13fcbab05ce14e06e0fcf8e593b7366d88c007247e4b2be7647a6555deadd84acfdf22d2aba6,31124ad7e75141de952961ac1071eba4edae4a6c4e9a3c394240f02da89d9edc3690ab78ee8e8c28897cd3e9564a6f595f88e8044236d1753fd27286a453b40c,49152:JX9cawE0UluIMwbS6YL5hbBVWrLiUQti3Uq:N6NE0UljMAMBVCr,3.2 MB,3229184.0,3229.184,0000:00:00 00:00:00,exe,-,6.694162,.text,0,[KERNEL32.DLL]  AddVectoredExceptionHandler CloseHandle CreateEventA CreateIoCompletionPort CreateThread DuplicateHandle ExitProcess FreeEnvironmentStringsW GetConsoleMode GetEnvironmentStringsW GetProcAddress GetProcessAffinityMask GetQueuedCompletionStatusEx GetStdHandle GetSystemDirectoryA GetSystemInfo GetThreadContext LoadLibraryA LoadLibraryW OpenProcess PostQueuedCompletionStatus ProcessIdToSessionId QueryFullProcessImageNameA ResumeThread SetConsoleCtrlHandler SetErrorMode SetEvent SetProcessPriorityBoost SetThreadContext SetUnhandledExceptionFilter SetWaitableTimer SuspendThread SwitchToThread VirtualAlloc VirtualFree VirtualQuery WaitForMultipleObjects WaitForSingleObject WriteConsoleW WriteFile,addvectoredexceptionhandler closehandle createevent createiocompletionport createthread duplicatehandle exitprocess freeenvironmentstrings getconsolemode getenvironmentstrings getprocaddress getprocessaffinitymask getqueuedcompletionstatus getstdhandle getsystemdirectory getsysteminfo getthreadcontext loadlibrary openprocess postqueuedcompletionstatus processidtosessionid queryfullprocessimagename resumethread setconsolectrlhandler seterrormode setevent setprocesspriorityboost setthreadcontext setunhandledexceptionfilter setwaitabletimer suspendthread switchtothread virtualalloc virtualfree virtualquery waitformultipleobjects waitforsingleobject writeconsole writefile,40,-,-,-,.data .idata .rdata .reloc .symtab .text,.data(19a00) .idata(600)  .rdata(15d400)  .reloc(9400)  .symtab(25c00)  .text(d3e00) ,PE Header (2.05368: not packed); .text (5.91316: not packed); .rdata (5.50917: not packed); .data (4.43398: not packed); .zdebug_abbrev (4.83203: not packed); .zdebug_line (7.99409: packed); .zdebug_frame (7.92435: packed); .zdebug_pubnames (7.87187: packed); .zdebug_pubtypes (7.96716: packed); .debug_gdb_scripts (0.791196: not packed); .zdebug_info (7.99626: packed); .zdebug_loc (7.99201: packed); .zdebug_ranges (7.79805: packed); .idata (3.68834: not packed); .reloc (5.44968: not packed); .symtab (5.3057: not packed),6,2,7,CobaltStrike.2,CobaltStrike.2
1c8de01df040c973b37ae5ce8e1bb523e1ba24a9c25263706022f9a9894a2e50,Win.Malware.Generickdz-9946554-0,-,CobaltStrike,1c8de01df040c973b37ae5ce8e1bb523e1ba24a9c25263706022f9a9894a2e50,84040f339a996a373ae8a0bb0e671be5,295fda9201323f640fd697faf69d2784e0135573,75a29dcc6db8f204f9bc8eb9365df86481440413c8a5b470e70f81bb,481f4921ceb5923455025e3d4b9e40c636e6a3766b5c4d9497e87385237c274dc4eb1729de5346f6e93c3e44d2e78153,b537b562bf34d7dc2ecdfcce629fd08046832067aa19e740fd0340b257caf8abf5073d1d3de9de8430a31965fefe9d3d5b92a0b5d67fc910bd35413da1145ec2,12288:myIEbOghGa96VBDDOu6J50EXg5/rSBtil:myIEP0VniSEXgNrSji,553 kB,552960.0,552.96,2021:03:15 19:27:20+00:00,dll,English - United States,6.047539,.text,335361,[ADVAPI32.DLL]  RegCloseKey RegCreateKeyExA RegDeleteKeyA RegEnumKeyA RegOpenKeyA RegOpenKeyExA RegQueryValueA RegQueryValueExA RegSetValueExA [COMDLG32.DLL]  GetFileTitleA [GDI32.DLL]  BitBlt CreateBitmap CreateCompatibleBitmap CreateCompatibleDC CreateDIBSection CreateFontIndirectA CreatePen CreateRectRgn CreateRectRgnIndirect CreateSolidBrush DeleteDC DeleteObject DPtoLP Ellipse EnumFontFamiliesExA Escape ExtSelectClipRgn ExtTextOutA GetBkColor GetBrushOrgEx GetClipBox GetCurrentObject GetDeviceCaps GetDIBColorTable GetDIBits GetMapMode GetObjectA GetPixel GetRgnBox GetStockObject GetTextColor GetTextMetricsA GetViewportExtEx GetWindowExtEx LineTo LPtoDP MoveToEx OffsetViewportOrgEx PtVisible Rectangle RectVisible RestoreDC SaveDC ScaleViewportExtEx ScaleWindowExtEx SelectClipRgn SelectObject SetBkColor SetBrushOrgEx SetDIBColorTable SetDIBits SetMapMode SetPixelV SetStretchBltMode SetTextColor SetViewportExtEx SetViewportOrgEx SetWindowExtEx StretchBlt TextOutA UnrealizeObject [KERNEL32.DLL]  CloseHandle CompareStringA CompareStringW ConvertDefaultLocale CreateFileA DecodePointer DeleteCriticalSection DuplicateHandle EncodePointer EnterCriticalSection EnumResourceLanguagesA ExitProcess FileTimeToLocalFileTime FileTimeToSystemTime FindClose FindFirstFileA FindNextFileA FindResourceA FindResourceExA FlsAlloc FlsFree FlsGetValue FlsSetValue FlushFileBuffers FormatMessageA FreeEnvironmentStringsA FreeEnvironmentStringsW FreeLibrary FreeResource GetACP GetCommandLineA GetConsoleCP GetConsoleMode GetConsoleOutputCP GetCPInfo GetCurrentDirectoryA GetCurrentProcess GetCurrentProcessId GetCurrentThread GetCurrentThreadId GetDriveTypeA GetEnvironmentStrings GetEnvironmentStringsW GetFileAttributesA GetFileSize GetFileSizeEx GetFileTime GetFileType GetFullPathNameA GetLastError GetLocaleInfoA GetModuleFileNameA GetModuleHandleA GetModuleHandleW GetOEMCP GetProcAddress GetStartupInfoA GetStdHandle GetStringTypeA GetStringTypeW GetSystemInfo GetSystemTimeAsFileTime GetThreadLocale GetTickCount GetTimeZoneInformation GetVersionExA GetVolumeInformationA GlobalAddAtomA GlobalAlloc GlobalDeleteAtom GlobalFindAtomA GlobalFlags GlobalFree GlobalGetAtomNameA GlobalHandle GlobalLock GlobalReAlloc GlobalUnlock HeapAlloc HeapCreate HeapDestroy HeapFree HeapQueryInformation HeapReAlloc HeapSetInformation HeapSize InitializeCriticalSection InitializeCriticalSectionAndSpinCount IsDebuggerPresent IsValidCodePage LCMapStringA LCMapStringW LeaveCriticalSection LoadLibraryA LoadLibraryW LoadResource LocalAlloc LocalFree LocalReAlloc LockFile LockResource lstrcmpA lstrcmpW lstrlenA MulDiv MultiByteToWideChar QueryPerformanceCounter RaiseException ReadFile RtlCaptureContext RtlLookupFunctionEntry RtlPcToFileHeader RtlUnwindEx RtlVirtualUnwind SetEndOfFile SetEnvironmentVariableA SetFilePointer SetHandleCount SetLastError SetStdHandle SetUnhandledExceptionFilter SizeofResource Sleep TerminateProcess TlsAlloc TlsGetValue TlsSetValue UnhandledExceptionFilter UnlockFile VirtualAlloc VirtualProtect VirtualQuery WideCharToMultiByte WriteConsoleA WriteConsoleW WriteFile WritePrivateProfileStringA [OLE32.DLL]  CLSIDFromProgID CLSIDFromString CoCreateInstance CoFreeUnusedLibraries CoGetClassObject CoInitialize CoInitializeEx CoRegisterMessageFilter CoRevokeClassObject CoTaskMemAlloc CoTaskMemFree CoUninitialize CreateILockBytesOnHGlobal OleFlushClipboard OleInitialize OleIsCurrentClipboard OleUninitialize StgCreateDocfileOnILockBytes StgOpenStorageOnILockBytes [OLEACC.DLL]  CreateStdAccessibleObject LresultFromObject [OLEAUT32.DLL]  DllRegisterServer OleTranslateColor SafeArrayGetDim SysReAllocString SysReAllocStringLen SysStringLen UnRegisterTypeLib VariantClear VariantCopy VariantCopyInd VariantInit VariantTimeToDosDateTime VariantTimeToSystemTime [OLEDLG.DLL]  OleUIBusyA [SHELL32.DLL]  DragFinish DragQueryFileA SHBrowseForFolderA SHGetMalloc SHGetPathFromIDListA [SHLWAPI.DLL]  PathFindExtensionA PathFindFileNameA PathIsUNCA PathRemoveFileSpecW PathStripToRootA [USER32.DLL]  AdjustWindowRectEx BeginPaint CallNextHookEx CallWindowProcA CharNextA CharUpperA CheckMenuItem ClientToScreen CopyAcceleratorTableA CopyImage CopyRect CreateDialogIndirectParamA CreateIconIndirect CreateWindowExA DefWindowProcA DestroyIcon DestroyMenu DestroyWindow DispatchMessageA DrawEdge DrawIconEx DrawTextA DrawTextExA EnableMenuItem EnableWindow EndDialog EndPaint EqualRect FillRect GetActiveWindow GetAsyncKeyState GetCapture GetClassInfoA GetClassInfoExA GetClassLongA GetClassLongPtrA GetClassNameA GetClientRect GetCursorPos GetDC GetDesktopWindow GetDlgCtrlID GetDlgItem GetFocus GetForegroundWindow GetIconInfo GetKeyState GetLastActivePopup GetMenu GetMenuCheckMarkDimensions GetMenuItemCount GetMenuItemID GetMenuState GetMessageA GetMessagePos GetMessageTime GetNextDlgGroupItem GetNextDlgTabItem GetParent GetPropA GetScrollPos GetSubMenu GetSysColor GetSysColorBrush GetSystemMetrics GetTopWindow GetWindow GetWindowDC GetWindowLongA GetWindowLongPtrA GetWindowPlacement GetWindowRect GetWindowTextA GetWindowTextLengthA GetWindowThreadProcessId GrayStringA InsertMenuA IntersectRect InvalidateRect InvalidateRgn IsChild IsDialogMessageA IsIconic IsRectEmpty IsWindow IsWindowEnabled IsWindowVisible LoadBitmapA LoadCursorA LoadIconA LoadImageA LoadMenuA MapDialogRect MapWindowPoints MessageBeep MessageBoxA ModifyMenuA MoveWindow OffsetRect PeekMessageA PostMessageA PostQuitMessage PostThreadMessageA PtInRect RedrawWindow RegisterClassA RegisterClipboardFormatA RegisterWindowMessageA ReleaseCapture ReleaseDC RemovePropA ScreenToClient SendDlgItemMessageA SendMessageA SetActiveWindow SetCapture SetCursor SetFocus SetForegroundWindow SetMenu SetMenuItemBitmaps SetPropA SetRect SetRectEmpty SetScrollInfo SetScrollPos SetWindowContextHelpId SetWindowLongA SetWindowLongPtrA SetWindowPos SetWindowsHookExA SetWindowTextA ShowWindow SystemParametersInfoA TabbedTextOutA TrackPopupMenu TranslateMessage UnhookWindowsHookEx UpdateWindow ValidateRect WindowFromPoint WinHelpA [WINSPOOL.DRV] ClosePrinter DocumentPropertiesA OpenPrinterA,adjustwindowrect beginpaint bitblt callnexthook callwindowproc charnext charupper checkmenuitem clienttoscreen closehandle closeprinter clsidfromprogid clsidfromstring cocreateinstance cofreeunusedlibraries cogetclassobject coinitialize comparestring convertdefaultlocale copyacceleratortable copyimage copyrect coregistermessagefilter corevokeclassobject cotaskmemalloc cotaskmemfree couninitialize createbitmap createcompatiblebitmap createcompatibledc createdialogindirectparam createdibsection createfile createfontindirect createiconindirect createilockbytesonhglobal createpen createrectrgn createrectrgnindirect createsolidbrush createstdaccessibleobject createwindow decodepointer defwindowproc deletecriticalsection deletedc deleteobject destroyicon destroymenu destroywindow dispatchmessage dllregisterserver documentproperties dptolp dragfinish dragqueryfile drawedge drawicon drawtext duplicatehandle ellipse enablemenuitem enablewindo encodepointer enddialog endpaint entercriticalsection enumfontfamilies enumresourcelanguages equalrect escape exitprocess extselectcliprgn exttextout filetimetolocalfiletime filetimetosystemtime fillrect findclose findfirstfile findnextfile findresource flsalloc flsfree flsgetvalue flssetvalue flushfilebuffers formatmessage freeenvironmentstrings freelibrary freeresource getacp getactivewindow getasynckeystate getbkcolor getbrushorg getcapture getclassinfo getclasslong getclasslongptr getclassname getclientrect getclipbox getcommandline getconsole getconsolemode getconsoleoutput getcpinfo getcurrentdirectory getcurrentobject getcurrentprocess getcurrentprocessid getcurrentthread getcurrentthreadid getcursorpos getdc getdesktopwindow getdevicecaps getdibcolortable getdibits getdlgctrlid getdlgitem getdrivetype getenvironmentstrings getfileattributes getfilesize getfiletime getfiletitle getfiletype getfocus getforegroundwindow getfullpathname geticoninfo getkeystate getlastactivepopup getlasterror getlocaleinfo getmapmode getmenu getmenucheckmarkdimensions getmenuitemcount getmenuitemid getmenustate getmessage getmessagepos getmessagetime getmodulefilename getmodulehandle getnextdlggroupitem getnextdlgtabitem getobject getoemcp getparent getpixel getprocaddress getprop getrgnbox getscrollpos getstartupinfo getstdhandle getstockobject getstringtype getsubmenu getsyscolor getsyscolorbrush getsysteminfo getsystemmetrics getsystemtimeasfiletime gettextcolor gettextmetrics getthreadlocale gettickcount gettimezoneinformation gettopwindow getversion getviewportext getvolumeinformation getwindow getwindowdc getwindowext getwindowlong getwindowlongptr getwindowplacement getwindowrect getwindowtext getwindowtextlength getwindowthreadprocessid globaladdatom globalalloc globaldeleteatom globalfindatom globalflags globalfree globalgetatomname globalhandle globallock globalrealloc globalunlock graystring heapalloc heapcreate heapdestroy heapfree heapqueryinformation heaprealloc heapsetinformation heapsize initializecriticalsection initializecriticalsectionandspincount insertmenu intersectrect invalidaterect invalidatergn ischild isdebuggerpresent isdialogmessage isiconic isrectempty isvalidcodepage iswindow iswindowenabled iswindowvisible lcmapstring leavecriticalsection lineto loadbitmap loadcursor loadicon loadimage loadlibrary loadmenu loadresource localalloc localfree localrealloc lockfile lockresource lptodp lresultfromobject lstrcmp lstrlen mapdialogrect mapwindowpoints messagebeep messagebox modifymenu moveto movewindow muldiv multibytetowidechar offsetrect offsetviewportorg oleflushclipboard oleinitialize oleiscurrentclipboard oletranslatecolor oleuibusy oleuninitialize openprinter pathfindextension pathfindfilename pathisunca pathremovefilespec pathstriptoroot peekmessage postmessage postquitmessage postthreadmessage ptinrect ptvisible queryperformancecounter raiseexception readfile rectangle rectvisible redrawwindow regclosekey regcreatekey regdeletekey regenumkey registerclass registerclipboardformat registerwindowmessage regopenkey regqueryvalue regsetvalue releasecapture releasedc removeprop restoredc rtlcapturecontext rtllookupfunctionentry rtlpctofileheader rtlunwind rtlvirtualunwind safearraygetdim savedc scaleviewportext scalewindowext screentoclient selectcliprgn selectobject senddlgitemmessage sendmessage setactivewindow setbkcolor setbrushorg setcapture setcursor setdibcolortable setdibits setendoffile setenvironmentvariable setfilepointer setfocus setforegroundwindow sethandlecount setlasterror setmapmode setmenu setmenuitembitmaps setpixelv setprop setrect setrectempty setscrollinfo setscrollpos setstdhandle setstretchbltmode settextcolor setunhandledexceptionfilter setviewportextex setviewportorgex setwindowcontexthelpid setwindowext setwindowlong setwindowlongptr setwindowpos setwindowshook setwindowtext shbrowseforfolder shgetmalloc shgetpathfromidlist showwindow sizeofresource sleep stgcreatedocfileonilockbytes stgopenstorageonilockbytes stretchblt sysreallocstring sysreallocstringlen sysstringlen systemparametersinfo tabbedtextout terminateprocess textout tlsalloc tlsgetvalue tlssetvalue trackpopupmenu translatemessage unhandledexceptionfilter unhookwindowshook unlockfile unrealizeobject unregistertypelib updatewindow validaterect variantclear variantcopy variantcopyind variantinit varianttimetodosdatetime varianttimetosystemtime virtualalloc virtualprotect virtualquery widechartomultibyte windowfrompoint winhelp winspool.drv writeconsole writefile writeprivateprofilestring,398,-,-,-,.data .pdata .rdata .reloc .rsrc .text,.data(3c00) .pdata(6200)  .rdata(1dc00)  .reloc(3a00)  .rsrc(5000)  .text(56800) ,PE Header (2.86053: not packed); .text (6.32907: not packed); .rdata (4.47222: not packed); .data (3.97895: not packed); .pdata (5.76655: not packed); .rsrc (4.14553: not packed); .reloc (3.48078: not packed),6,3,6,CobaltStrike.3,
