sha256_hash,clam_av_scan_results,yara_malware,family_name,sample_name,md5_hash,sha1_hash,sha224_hash,sha384_hash,sha512_hash,ssdeep,file_size,binary_file_size,binary_file_size_kb,time_stamp,file_type_extension,summary_detected_languages,entropy(min=0.0; max=8.0),execution_section_name,execution_size_bytes,import_functions,standardized_import_functions,count_import_functions,peid,yara_packer,yara_rat,code_sections,code_section_sizes,entropy_per_section,number_sections,intra_family_cosine_similarity_cluster,intra_family_kmeans_cluster,malware_variant,malware_variant_centroid
9af4b3b8c67d21fef69dee132cb686d1cb9e34e2d5e807b05c2a92e48f08dd39,Win.Trojan.Generic-9879180-0,-,CobaltStrike,9af4b3b8c67d21fef69dee132cb686d1cb9e34e2d5e807b05c2a92e48f08dd39,3c21cccff5c8aabf1977f2dbdaeaafe7,88ae2ed9e9ceeba5cf578c994e1b2493bfddd112,bc338e37ad028bded007ece6ee6518cf8459fde905cf7b42ac013043,3868c355b4140d103f64e0eb93ee1674e7ca4beaa36dadbef04db56c85b463974c016403da2813689b3ed55613fc273b,9c34e3b9611928217a01f910c4036199411730129a6010fe70cb3b7b3530dff90da564ee0238cbe4241e847c506cedd4676dfa8bec67222177f3d861b571958f,6144:OpWMSmgY0IyFpXjsCEqhp3xuo8Pr7Jjc7wPxyC:/HP7LFVst+0oA71+FC,348 kB,348160.0,348.16,2021:07:14 09:58:02+00:00,exe,Chinese - PRC,7.809964,.rda,4012856944,[GDI32.DLL]  GetBitmapBits GetCharWidthW GetDeviceCaps GetObjectW GetPaletteEntries [KERNEL32.DLL]  AddConsoleAliasA DeleteVolumeMountPointW EnumSystemLocalesA EraseTape FillConsoleOutputAttribute FindFirstFileA GetConsoleCursorInfo GetCurrentConsoleFont GetLocaleInfoW GetModuleHandleA GetModuleHandleW GetProcAddress GetProcessAffinityMask GlobalAddAtomW GlobalFindAtomA HeapCreate HeapWalk LoadLibraryA LoadLibraryExW LocalFree LockFile SetFileAttributesW [MSVCRT.DLL]  memset [OLE32.DLL]  CoFreeUnusedLibrariesEx [POWRPROF.DLL]  IsPwrHibernateAllowed ReadGlobalPwrPolicy [USER32.DLL]  GetClipboardFormatNameA GetWindowRect InsertMenuA IsWindow SetCursor ShowCaret [WININET.DLL]  RetrieveUrlCacheEntryStreamW [WINSPOOL.DRV] FindNextPrinterChangeNotification,addconsolealias cofreeunusedlibraries deletevolumemountpoint enumsystemlocales erasetape fillconsoleoutputattribute findfirstfile findnextprinterchangenotification getbitmapbits getcharwidth getclipboardformatname getconsolecursorinfo getcurrentconsolefont getdevicecaps getlocaleinfo getmodulehandle getobject getpaletteentries getprocaddress getprocessaffinitymask getwindowrect globaladdatom globalfindatom heapcreate heapwalk insertmenu ispwrhibernateallowed iswindow loadlibrary localfree lockfile memset readglobalpwrpolicy retrieveurlcacheentrystream setcursor setfileattributes showcaret winspool.drv,39,-,-,-,.data1 .m5fih .rda .rdata .reloc,.data1(5000) .m5fih(1000)  .rda(4c000)  .rdata(1000)  .reloc(1000) ,PE Header (0.90258: not packed); .rda (7.9535: packed); .rdata (4.24508: not packed); .data1 (7.29177: packed); .m5Fih (0.924854: not packed); .reloc (3.60979: not packed),5,4,4,CobaltStrike.4,CobaltStrike.4
cff4bdbf0ed1b324aa9691af0c0819bf0140ade95384557f546acc01af3d8326,OK,-,CobaltStrike,cff4bdbf0ed1b324aa9691af0c0819bf0140ade95384557f546acc01af3d8326,1f7437497eda90b06489fdc2328bb8ae,1549c37da035f3c985cf59280eeaf7a0a424289f,8330e46678800d6231b52c993117c0dbe6266a0d3a9ca8c17d08d0bd,93bba017091569a0327e150ef32b621ddd115e12d02ba0b3223bd2c3ec9dfd32fd5f443c87738e5791c76a59ce800312,db747e1800d854b82dafbd59ba4bba0fc23734a868a9ee82f3cfeb2313f09265e7225042676b853f97c8161d6eedd676aea6683f1bfbec9f10d85df78c310f13,12288:aA+QuYAS3W3e85ZqFfbIKGgiNz4uJL3g+AjZWQcpWFYK9751tjxB88888888888:aAXuYAS31SSdozJx3g+Ajsg97L,864 kB,864256.0,864.256,2021:03:22 13:14:34+00:00,exe,Czech - Czech Republic; English - United States,7.52091,.text,18446744073438546643,[ADVAPI32.DLL]  RegOpenKeyW RegQueryValueExW [GDI32.DLL]  AbortPath CreatePatternBrush CreateSolidBrush DeleteDC FillPath GetBkColor GetBkMode GetObjectType GetPixelFormat GetStretchBltMode GetTextAlign SwapBuffers [KERNEL32.DLL]  GetModuleHandleA GetProcAddress LoadLibraryA SetErrorMode [USER32.DLL]  CharLowerA CharNextA CloseDesktop GetClipboardData GetClipboardOwner GetClipboardViewer GetLastActivePopup GetProcessWindowStation GetWindowDC IsCharLowerW IsCharUpperA IsClipboardFormatAvailable IsWindowUnicode LoadIconA PaintDesktop VkKeyScanW,abortpath charlower charnext closedesktop createpatternbrush createsolidbrush deletedc fillpath getbkcolor getbkmode getclipboarddata getclipboardowner getclipboardviewer getlastactivepopup getmodulehandle getobjecttype getpixelformat getprocaddress getprocesswindowstation getstretchbltmode gettextalign getwindowdc ischarlower ischarupper isclipboardformatavailable iswindowunicode loadicon loadlibrary paintdesktop regopenkey regqueryvalue seterrormode swapbuffers vkkeyscan,34,-,-,-,.data .data2 .data3 .pdata .rdata .rsrc .text,.data(200) .data2(2c00)  .data3(2c00)  .pdata(200)  .rdata(600)  .rsrc(9600)  .text(c3400) ,PE Header (2.55657: not packed); .text (7.6285: packed); .rdata (4.1944: not packed); .data (1.74144: not packed); .pdata (1.37287: not packed); .data3 (0.00012808: not packed); .data2 (0.00012808: not packed); .rsrc (3.70693: not packed),7,-1,1,,
7a51bf0527aa3f38ee5a9ae52c1a4f63d67d68af2da7b488f8ba7b66d665e618,OK,-,CobaltStrike,7a51bf0527aa3f38ee5a9ae52c1a4f63d67d68af2da7b488f8ba7b66d665e618,8e96a9977d96e47db7c33cf350338b87,84842f681f7640332f51e283aa8988cb37f4ff77,d6131168bf45093509d4d3d21c7c476246061613c74284c95887fe5c,ce2cfaa6db0eed5a36de0ed5a66245085aec27d0e336662cb68ff4bbdc2915a0bdad0c29b23cc599c9ddc0f0a8f57aff,627627d69c9d5e065803a938839d6aa8cfbb8518c2cb40dc7959639eed406c255d343a773e30dc2c3f169576991a44148f97679677f5a5c041d1a4397c3f1eca,49152:PXkBqWXVR8fkWKGEg+hGUlHJgxMt/N0+kZ:P04Ux7g+hGUDgx0a+O,2.6 MB,2621808.0,2621.808,2021:10:27 06:00:45+00:00,exe,Chinese - PRC; English - United States,7.98021,.text,93873,[KERNEL32.DLL]  CloseHandle CreateFileW DeleteCriticalSection EnterCriticalSection ExitProcess FindClose FindFirstFileExW FindNextFileW FlushFileBuffers FreeEnvironmentStringsW FreeLibrary GetACP GetCommandLineA GetCommandLineW GetConsoleCP GetConsoleMode GetCPInfo GetCurrentProcess GetCurrentProcessId GetCurrentThreadId GetEnvironmentStringsW GetFileType GetLastError GetModuleFileNameW GetModuleHandleExW GetModuleHandleW GetOEMCP GetProcAddress GetProcessHeap GetStartupInfoW GetStdHandle GetStringTypeW GetSystemTimeAsFileTime HeapAlloc HeapCreate HeapFree HeapReAlloc HeapSize InitializeCriticalSectionAndSpinCount InitializeSListHead IsDebuggerPresent IsProcessorFeaturePresent IsValidCodePage LCMapStringW LeaveCriticalSection LoadLibraryExW MultiByteToWideChar QueryPerformanceCounter RaiseException RtlCaptureContext RtlLookupFunctionEntry RtlUnwindEx RtlVirtualUnwind SetFilePointerEx SetLastError SetStdHandle SetUnhandledExceptionFilter TerminateProcess TlsAlloc TlsFree TlsGetValue TlsSetValue UnhandledExceptionFilter WideCharToMultiByte WriteConsoleW WriteFile,closehandle createfile deletecriticalsection entercriticalsection exitprocess findclose findfirstfile findnextfile flushfilebuffers freeenvironmentstrings freelibrary getacp getcommandline getconsole getconsolemode getcpinfo getcurrentprocess getcurrentprocessid getcurrentthreadid getenvironmentstrings getfiletype getlasterror getmodulefilename getmodulehandle getoemcp getprocaddress getprocessheap getstartupinfo getstdhandle getstringtype getsystemtimeasfiletime heapalloc heapcreate heapfree heaprealloc heapsize initializecriticalsectionandspincount initializeslisthead isdebuggerpresent isprocessorfeaturepresent isvalidcodepage lcmapstring leavecriticalsection loadlibrary multibytetowidechar queryperformancecounter raiseexception rtlcapturecontext rtllookupfunctionentry rtlunwind rtlvirtualunwind setfilepointer setlasterror setstdhandle setunhandledexceptionfilter terminateprocess tlsalloc tlsfree tlsgetvalue tlssetvalue unhandledexceptionfilter widechartomultibyte writeconsole writefile,66,-,-,-,.data .pdata .rdata .reloc .rsrc .text,.data(259000) .pdata(e00)  .rdata(8600)  .reloc(800)  .rsrc(3000)  .text(17400) ,PE Header (2.8877: not packed); .text (6.68501: packed); .rdata (4.83192: not packed); .data (7.99977: packed); .pdata (4.84924: not packed); .rsrc (4.10887: not packed); .reloc (4.78604: not packed); Overlay (7.56141: packed),6,0,3,CobaltStrike.0,CobaltStrike.0
19f8797dc1c69909d8d0fb563d13e955dc98a1d22fdf8b2c551731323d672505,OK,-,CobaltStrike,19f8797dc1c69909d8d0fb563d13e955dc98a1d22fdf8b2c551731323d672505,41df87cc97cd4727e5fe266c6c06e10d,0bbfe2506656fe8ebd432c3721758207f36fa0fd,960a6e4dc234bc71c3890622c3dfff987a9b70bb0246696740e0048c,a9d43e1e11b68b2c4651b621bc131ff0439c6f787631a1c3a5f43e38a7d75420fcd8381fd713e22d3db853ae95a76a72,7d67b3c11317386971463919e6f8ab479c6b62cd8017a13bbe65acaf8d8fc09ee186d6cde9d3af58e25b4d22f3f94b25f5bca230062bed67d13b8b21d648d191,1536:UufJG5bVxZAhEcT1yULhiAJ0CuQUcvhvM:I5bcT8ULR4g,87 kB,86528.0,86.528,2009:07:13 23:24:04+00:00,exe,English - United States,6.529898,.text,2313811713,[ADVAPI32.DLL]  EventRegister EventUnregister EventWrite GetTraceEnableFlags GetTraceEnableLevel GetTraceLoggerHandle RegCloseKey RegDeleteKeyValueW RegEnumKeyExW RegEnumValueW RegGetValueW RegisterTraceGuidsW RegOpenKeyExW RegSetKeyValueW TraceMessage UnregisterTraceGuids [BCRYPT.DLL]  BCryptCloseAlgorithmProvider BCryptCreateHash BCryptDestroyHash BCryptFinishHash BCryptGetProperty BCryptHashData BCryptOpenAlgorithmProvider [DEVOBJ.DLL]  DevObjCreateDeviceInfoList DevObjDestroyDeviceInfoList DevObjGetDeviceProperty DevObjOpenDeviceInfo [DMRC.DLL]  DMrcExit DMrcGetProperties DMrcInit DMrcQueryClose DMrcQueryHardwareId DMrcQueryModelId [KERNEL32.DLL]  AcquireSRWLockExclusive AcquireSRWLockShared CloseHandle CloseThreadpoolTimer CloseThreadpoolWork CreateEventW CreateFileW CreateThreadpoolTimer CreateThreadpoolWork DuplicateHandle GetComputerNameExW GetCurrentProcess GetCurrentProcessId GetCurrentThreadId GetFileSizeEx GetLastError GetModuleHandleA GetStartupInfoA GetSystemFirmwareTable GetSystemTimeAsFileTime GetTickCount GlobalAlloc GlobalFree InitializeSRWLock InterlockedCompareExchange InterlockedDecrement InterlockedExchange InterlockedIncrement MultiByteToWideChar QueryPerformanceCounter ReadFile ReleaseSRWLockExclusive ReleaseSRWLockShared ResetEvent SetEvent SetFilePointerEx SetThreadpoolTimer SetUnhandledExceptionFilter Sleep SubmitThreadpoolWork TerminateProcess UnhandledExceptionFilter WaitForSingleObject WaitForThreadpoolTimerCallbacks WaitForThreadpoolWorkCallbacks WriteFile [MSVCRT.DLL]  Getmainargs PCommode PFmode Rtdynamiccast SetAppType Setusermatherr Acmdln AmsgExit Callnewh Cexit Controlfp ExceptHandler4Common Exit Initterm Ismbblead Purecall Vsnwprintf Wcsicmp Wcsnicmp Xcptfilter exit free malloc memcpy memset qsort Sym.imp.voidCdeclTerminate(void) wcschr wcsstr [OLE32.DLL]  CLSIDFromString CoAddRefServerProcess CoCreateInstance CoInitializeEx CoRegisterClassObject CoReleaseServerProcess CoRevokeClassObject CoTaskMemAlloc CoTaskMemFree CoUninitialize CreateStreamOnHGlobal IIDFromString PropVariantClear StringFromGUID2 StringFromIID [PROPSYS.DLL]  PSPropertyKeyFromString [USER32.DLL]  DisplayConfigGetDeviceInfo GetDisplayConfigBufferSizes QueryDisplayConfig [XMLLITE.DLL]  CreateXmlReader,acmdln acquiresrwlockexclusive acquiresrwlockshared amsgexit bcryptclosealgorithmprovider bcryptcreatehash bcryptdestroyhash bcryptfinishhash bcryptgetproperty bcrypthashdata bcryptopenalgorithmprovider callnewh cexit closehandle closethreadpooltimer closethreadpoolwork clsidfromstring coaddrefserverprocess cocreateinstance coinitialize controlfp coregisterclassobject coreleaseserverprocess corevokeclassobject cotaskmemalloc cotaskmemfree couninitialize createevent createfile createstreamonhglobal createthreadpooltimer createthreadpoolwork createxmlreader devobjcreatedeviceinfolist devobjdestroydeviceinfolist devobjgetdeviceproperty devobjopendeviceinfo displayconfiggetdeviceinfo dmrcexit dmrcgetproperties dmrcinit dmrcqueryclose dmrcqueryhardwareid dmrcquerymodelid duplicatehandle eventregister eventunregister eventwrite excepthandler4common exit free getcomputername getcurrentprocess getcurrentprocessid getcurrentthreadid getdisplayconfigbuffersizes getfilesize getlasterror getmainargs getmodulehandle getstartupinfo getsystemfirmwaretable getsystemtimeasfiletime gettickcount gettraceenableflags gettraceenablelevel gettraceloggerhandle globalalloc globalfree iidfromstring initializesrwlock initterm interlockedcompareexchange interlockeddecrement interlockedexchange interlockedincrement ismbblead malloc memcpy memset multibytetowidechar pcommode pfmode propvariantclear pspropertykeyfromstring purecall qsort querydisplayconfig queryperformancecounter readfile regclosekey regdeletekeyvalue regenumkey regenumvalue reggetvalue registertraceguids regopenkey regsetkeyvalue releasesrwlockexclusive releasesrwlockshared resetevent rtdynamiccast setapptype setevent setfilepointer setthreadpooltimer setunhandledexceptionfilter setusermatherr sleep stringfromguid2 stringfromiid submitthreadpoolwork sym.imp.voidcdeclterminate(void) terminateprocess tracemessage unhandledexceptionfilter unregistertraceguids vsnwprintf waitforsingleobject waitforthreadpooltimercallback waitforthreadpoolworkcallback wcschr wcsicmp wcsnicmp wcsstr writefile xcptfilter,128,-,-,-,.data .reloc .rsrc .text,.data(600) .reloc(1200)  .rsrc(800)  .text(12e00) ,PE Header (3.72254: not packed); .text (6.50397: packed); .data (3.9202: not packed); .rsrc (4.18491: not packed); .reloc (6.15339: not packed),4,-1,1,,
a7cbeeba9fd5f17a1e5be18ea55db5727fe1c7f69471f7b28dae1887900d763b,OK,-,CobaltStrike,a7cbeeba9fd5f17a1e5be18ea55db5727fe1c7f69471f7b28dae1887900d763b,e9c6c2b94fc83f24effc76bf84274039,0e21a0a54aedf5f4a4693071bd9b7f66c4234621,4b49354ce029260f9077a59fb33886584fcef9d78073594cc3087e1e,88d1d69fc08a38ccc9176f8e72692c67d7213bbf0f2996c55688d3395658f9be4afc3f18239cf61cae588a1af583433d,96ebcc90f51ebf772af274c408870cd7bb003bf7043befa5dd6ce4100243ba19e408bd8bb9e983f8c423d200cf3599f1d693e3d2c83eea46e3111a126a2fd926,12288:4cqYrjApJ+t4IENh9nssw7zCXq9xJ8v6nUw5fW:NVrjAP+t4IHheqhPn/fW,598 kB,597504.0,597.504,2022:02:02 10:14:11+00:00,exe,-,7.473625,.text,4011744203,[MSCOREE.DLL]  Corexemain,corexemain,1,-,NETexecutableMicrosoft,-,.reloc .rsrc .text,.reloc(200) .rsrc(3800)  .text(8e200) ,PE Header (2.68383: not packed); .text (7.52268: packed); .rsrc (3.99413: not packed); .reloc (0.0843572: not packed),3,5,5,CobaltStrike.5,CobaltStrike.5
d2ec6b7a4c7d661c0aba50ffdf9d2bb1b50392d1a5ce30dde75dee9c36341a91,OK,-,CobaltStrike,d2ec6b7a4c7d661c0aba50ffdf9d2bb1b50392d1a5ce30dde75dee9c36341a91,e257a779275988ccf302f54dae016de9,bbc05184a18234110e3d2590723fe51945a79d85,b9e0e03a2e8e7f03d0d8a9206b158cf1428f2697aea0ac78d38cd6bb,1d1999c2bbe36ff93116bd478ce2f6a2e2e1dd1af5bbcb4c02fa0081ad305107e9687b3f2fdfb4f26ad433733d40c96f,6af312c9d26c8f9f8d7a9c1ad8e2b10c98ba582b4016a8b920c4d3412133cbd7f9356d7f42934a2c068c4cdef6347d53fb368b182ee299bc63ba019db5a8fe17,6144:Olv9FTLTngVYFsMD+tgYB7/XSv1h/3lHlZOsKOzgqpE6YzEgmlY:Olv9FTLTngcsMSXB7/XwNFlgOIx0,342 kB,341504.0,341.504,2021:05:20 18:57:10+00:00,exe,English - United States,5.939753,.text,210033,[ADVAPI32.DLL]  RegCloseKey RegCreateKeyExA RegDeleteKeyA RegEnumKeyA RegOpenKeyA RegOpenKeyExA RegQueryValueA RegQueryValueExA RegSetValueExA [GDI32.DLL]  BitBlt CombineRgn CreateBitmap CreateCompatibleBitmap CreateCompatibleDC CreateEllipticRgn CreatePen CreatePolygonRgn CreateRectRgn CreateSolidBrush DeleteDC DeleteObject Ellipse Escape ExtCreateRegion ExtTextOutA GetBitmapDimensionEx GetClipBox GetCurrentObject GetDeviceCaps GetDIBits GetObjectA GetPixel GetRegionData GetStockObject LineTo MoveToEx OffsetRgn OffsetViewportOrgEx Polygon PtInRegion PtVisible RealizePalette Rectangle RectVisible RestoreDC SaveDC ScaleViewportExtEx ScaleWindowExtEx SelectObject SelectPalette SetBitmapDimensionEx SetBkColor SetDIBits SetMapMode SetStretchBltMode SetTextColor SetViewportExtEx SetViewportOrgEx SetWindowExtEx StretchBlt TextOutA [KERNEL32.DLL]  CloseHandle CompareStringA ConvertDefaultLocale CreateFileA DeleteCriticalSection EnterCriticalSection EnumResourceLanguagesA ExitProcess FindResourceA FlsAlloc FlsFree FlsGetValue FlsSetValue FlushFileBuffers FormatMessageA FreeEnvironmentStringsA FreeEnvironmentStringsW FreeLibrary FreeResource GetACP GetCommandLineA GetConsoleCP GetConsoleMode GetConsoleOutputCP GetCPInfo GetCurrentProcess GetCurrentProcessId GetCurrentThread GetCurrentThreadId GetEnvironmentStrings GetEnvironmentStringsW GetFileType GetLastError GetLocaleInfoA GetModuleFileNameA GetModuleFileNameW GetModuleHandleA GetOEMCP GetProcAddress GetProcessHeap GetStartupInfoA GetStdHandle GetStringTypeA GetStringTypeW GetSystemTimeAsFileTime GetThreadLocale GetTickCount GetVersion GetVersionExA GlobalAddAtomA GlobalAlloc GlobalDeleteAtom GlobalFindAtomA GlobalFlags GlobalFree GlobalGetAtomNameA GlobalHandle GlobalLock GlobalReAlloc GlobalUnlock HeapAlloc HeapCreate HeapFree HeapReAlloc HeapSetInformation HeapSize InitializeCriticalSection IsDebuggerPresent LCMapStringA LCMapStringW LeaveCriticalSection LoadLibraryA LoadResource LocalAlloc LocalFree LocalReAlloc LockResource lstrcmpA lstrcmpW lstrlenA MulDiv MultiByteToWideChar QueryPerformanceCounter RaiseException ReadFile RtlCaptureContext RtlLookupFunctionEntry RtlPcToFileHeader RtlUnwindEx RtlVirtualUnwind SetErrorMode SetFilePointer SetHandleCount SetLastError SetStdHandle SetUnhandledExceptionFilter SizeofResource Sleep TerminateProcess TlsAlloc TlsFree TlsGetValue TlsSetValue UnhandledExceptionFilter VirtualAlloc WideCharToMultiByte WriteConsoleA WriteConsoleW WriteFile WritePrivateProfileStringA [NTDLL.DLL]  Chkstk LdrLoadDll memcpy memset RtlInitUnicodeString ZwOpenSymbolicLinkObject [OLEACC.DLL]  CreateStdAccessibleObject LresultFromObject [OLEAUT32.DLL]  SysReAllocStringLen VariantClear VariantCopy VariantTimeToDosDateTime [SHLWAPI.DLL]  PathFindExtensionA PathFindFileNameA [USER32.DLL]  AdjustWindowRectEx AppendMenuA BeginPaint CallNextHookEx CallWindowProcA CheckMenuItem ClientToScreen CopyRect CreateDialogIndirectParamA CreateWindowExA DefWindowProcA DestroyMenu DestroyWindow DispatchMessageA DrawIcon DrawTextA DrawTextExA EnableMenuItem EnableWindow EndDialog EndPaint GetActiveWindow GetCapture GetClassInfoA GetClassInfoExA GetClassLongA GetClassLongPtrA GetClassNameA GetClientRect GetCursorPos GetDC GetDesktopWindow GetDlgCtrlID GetDlgItem GetFocus GetForegroundWindow GetKeyState GetLastActivePopup GetMenu GetMenuCheckMarkDimensions GetMenuItemCount GetMenuItemID GetMenuState GetMessageA GetMessagePos GetMessageTime GetNextDlgTabItem GetParent GetPropA GetSubMenu GetSysColor GetSysColorBrush GetSystemMenu GetSystemMetrics GetTopWindow GetWindow GetWindowLongA GetWindowLongPtrA GetWindowPlacement GetWindowRect GetWindowTextA GetWindowThreadProcessId GrayStringA InflateRect IntersectRect InvalidateRect IsDialogMessageA IsIconic IsWindow IsWindowEnabled IsWindowVisible LoadBitmapA LoadCursorA LoadIconA MapWindowPoints MessageBoxA ModifyMenuA PeekMessageA PostMessageA PostQuitMessage PtInRect RegisterClassA RegisterWindowMessageA ReleaseDC RemovePropA ScreenToClient SendDlgItemMessageA SendMessageA SetActiveWindow SetCursor SetFocus SetForegroundWindow SetMenuItemBitmaps SetPropA SetRectEmpty SetWindowLongA SetWindowLongPtrA SetWindowPos SetWindowsHookExA SetWindowTextA ShowWindow SystemParametersInfoA TabbedTextOutA TranslateMessage UnhookWindowsHookEx UnregisterClassA UpdateWindow ValidateRect WindowFromPoint WinHelpA [WINSPOOL.DRV] ClosePrinter DocumentPropertiesA OpenPrinterA,adjustwindowrect appendmenu beginpaint bitblt callnexthook callwindowproc checkmenuitem chkstk clienttoscreen closehandle closeprinter combinergn comparestring convertdefaultlocale copyrect createbitmap createcompatiblebitmap createcompatibledc createdialogindirectparam createellipticrgn createfile createpen createpolygonrgn createrectrgn createsolidbrush createstdaccessibleobject createwindow defwindowproc deletecriticalsection deletedc deleteobject destroymenu destroywindow dispatchmessage documentproperties drawicon drawtext ellipse enablemenuitem enablewindo enddialog endpaint entercriticalsection enumresourcelanguages escape exitprocess extcreateregion exttextout findresource flsalloc flsfree flsgetvalue flssetvalue flushfilebuffers formatmessage freeenvironmentstrings freelibrary freeresource getacp getactivewindow getbitmapdimension getcapture getclassinfo getclasslong getclasslongptr getclassname getclientrect getclipbox getcommandline getconsole getconsolemode getconsoleoutput getcpinfo getcurrentobject getcurrentprocess getcurrentprocessid getcurrentthread getcurrentthreadid getcursorpos getdc getdesktopwindow getdevicecaps getdibits getdlgctrlid getdlgitem getenvironmentstrings getfiletype getfocus getforegroundwindow getkeystate getlastactivepopup getlasterror getlocaleinfo getmenu getmenucheckmarkdimensions getmenuitemcount getmenuitemid getmenustate getmessage getmessagepos getmessagetime getmodulefilename getmodulehandle getnextdlgtabitem getobject getoemcp getparent getpixel getprocaddress getprocessheap getprop getregiondata getstartupinfo getstdhandle getstockobject getstringtype getsubmenu getsyscolor getsyscolorbrush getsystemmenu getsystemmetrics getsystemtimeasfiletime getthreadlocale gettickcount gettopwindow getversion getwindow getwindowlong getwindowlongptr getwindowplacement getwindowrect getwindowtext getwindowthreadprocessid globaladdatom globalalloc globaldeleteatom globalfindatom globalflags globalfree globalgetatomname globalhandle globallock globalrealloc globalunlock graystring heapalloc heapcreate heapfree heaprealloc heapsetinformation heapsize inflaterect initializecriticalsection intersectrect invalidaterect isdebuggerpresent isdialogmessage isiconic iswindow iswindowenabled iswindowvisible lcmapstring ldrloaddll leavecriticalsection lineto loadbitmap loadcursor loadicon loadlibrary loadresource localalloc localfree localrealloc lockresource lresultfromobject lstrcmp lstrlen mapwindowpoints memcpy memset messagebox modifymenu moveto muldiv multibytetowidechar offsetrgn offsetviewportorg openprinter pathfindextension pathfindfilename peekmessage polygon postmessage postquitmessage ptinrect ptinregion ptvisible queryperformancecounter raiseexception readfile realizepalette rectangle rectvisible regclosekey regcreatekey regdeletekey regenumkey registerclass registerwindowmessage regopenkey regqueryvalue regsetvalue releasedc removeprop restoredc rtlcapturecontext rtlinitunicodestring rtllookupfunctionentry rtlpctofileheader rtlunwind rtlvirtualunwind savedc scaleviewportext scalewindowext screentoclient selectobject selectpalette senddlgitemmessage sendmessage setactivewindow setbitmapdimensionex setbkcolor setcursor setdibits seterrormode setfilepointer setfocus setforegroundwindow sethandlecount setlasterror setmapmode setmenuitembitmaps setprop setrectempty setstdhandle setstretchbltmode settextcolor setunhandledexceptionfilter setviewportextex setviewportorgex setwindowext setwindowlong setwindowlongptr setwindowpos setwindowshook setwindowtext showwindow sizeofresource sleep stretchblt sysreallocstringlen systemparametersinfo tabbedtextout terminateprocess textout tlsalloc tlsfree tlsgetvalue tlssetvalue translatemessage unhandledexceptionfilter unhookwindowshook unregisterclass updatewindow validaterect variantclear variantcopy varianttimetodosdatetime virtualalloc widechartomultibyte windowfrompoint winhelp winspool.drv writeconsole writefile writeprivateprofilestring zwopensymboliclinkobject,298,-,-,-,.data .pdata .rdata .rsrc .text,.data(2c00) .pdata(4600)  .rdata(13800)  .rsrc(4c00)  .text(33c00) ,PE Header (2.57653: not packed); .text (6.29846: not packed); .rdata (4.5514: not packed); .data (3.23223: not packed); .pdata (5.47945: not packed); .rsrc (3.86479: not packed),5,3,6,CobaltStrike.3,
